{
  "kind": "apm2.rfc.proposal.v1",
  "base_revision_hash": "5eb033085a336db6a07279f4e8da163bce182139749fb47071f04a994089d2ea",
  "summary": "Strengthen PSI containment surface by adding epoch-seal ordering proof requirements, hardware kill replay guards, audit bypass manifest verification, and constitutional admissibility enforcement visibility.",
  "rationale": "Four containment gaps detected: (1) Section 4.11 SovereignAuditResponseV1 specifies epoch-order proof requirement when request.required_epoch_id is set, but Section 6.5 verification algorithm does not enforce it, creating audit-temporal bypass risk. (2) Section 4.15 HardwareKillActivationReceiptV1 allows null stop_order_id for physical activations but lacks reconciliation requirements before resume, creating unbound-activation drift risk. (3) Section 4.11b AuditBypassManifestV1 is referenced in constraints but not verified in Section 6.5 algorithm, allowing mediated-only audit responses to pass. (4) Section 0.3 defines constitutional admissibility precheck booleans but acceptance criteria (Section 10.5) do not verify their enforcement, allowing governance evidence to omit humanitarian/containment precheck reporting. All fixes preserve RFC-0020 floors, maintain fail-closed posture, and close verification-correctness gaps without liveness regression.",
  "diffs": [
    "--- a/documents/rfcs/RFC-0022/PRINCIPAL_SOVEREIGNTY_INTERFACE.md\n+++ b/documents/rfcs/RFC-0022/PRINCIPAL_SOVEREIGNTY_INTERFACE.md\n@@ -1168,6 +1168,7 @@ Constraints:\n 3. If `request.required_epoch_id` is set, `served_epoch_order_proof_hash` MUST prove `served_epoch_id` is the same epoch or a descendant in admitted epoch-seal order.\n 4. Ranged queries require valid omission proof plus contiguous coverage proof.\n 5. If confidential payloads are returned, `declassification_receipt_hashes` MUST be non-empty.\n-6. `served_integrity_floor` and `served_confidentiality_ceiling` MUST satisfy Section 3.3a lattice-order rules.\n-7. If `request.include_confidential_payloads=false`, response MUST keep `served_confidentiality_ceiling=PUBLIC` and `declassification_receipt_hashes=[]`.\n+6. If `request.required_epoch_id` is set and `served_epoch_id != request.required_epoch_id`, `served_epoch_order_proof_hash` MUST be non-null and valid.\n+7. `served_integrity_floor` and `served_confidentiality_ceiling` MUST satisfy Section 3.3a lattice-order rules.\n+8. If `request.include_confidential_payloads=false`, response MUST keep `served_confidentiality_ceiling=PUBLIC` and `declassification_receipt_hashes=[]`.\n@@ -1263,7 +1264,9 @@ Constraints:\n 4. If `stop_order_id` is non-null, `stop_order_id` and `challenge_nonce_echo` MUST match the active `SovereignStopOrderV1`.\n 5. For principal physical activation when the software control path is unavailable, `stop_order_id` and `challenge_nonce_echo` MAY be null; this remains safety-authoritative and MUST force global freeze.\n-6. Reuse of non-null `(stop_order_id, challenge_nonce_echo)` across distinct `activation_id` values is a replay defect and MUST fail closed.\n-7. Any null-bound activation MUST produce a reconciliation receipt before any sovereign resume is admissible.\n+6. Replay guards:\n+   a. Reuse of non-null `(stop_order_id, challenge_nonce_echo)` across distinct `activation_id` values is a replay defect and MUST fail closed.\n+   b. Reuse of non-null `(actuator_id, activation_edge_tick, challenge_nonce_echo)` across distinct `activation_id` values is a replay defect and MUST fail closed.\n+7. Any null-bound activation (where `stop_order_id` is null) MUST produce a reconciliation receipt proving activation binding to subsequent epoch state before any `SovereignResumeOrderV1` admission is permitted.\n \n ### 4.16 CapsuleIntegrityProofV1\n@@ -1593,6 +1596,7 @@ verify_audit_response(resp):\n   require resp.request_digest == hash(request)\n   require verify_authority_seal(resp.responder_seal_hash, resp.request_id)\n   require verify_completeness_attestation(resp)\n+  require verify_audit_bypass_manifest(resp.audit_bypass_manifest_hash)\n   require resp.response_nonce_echo == request.request_nonce\n   require verify_epoch_order(resp.served_epoch_id, request.required_epoch_id, resp.served_epoch_order_proof_hash) when set\n@@ -2029,6 +2033,9 @@ jq -e '\n   .proof_complexity.audit_batch == \"O(log n + k)\" and\n   .proof_profile_valid == true and\n   .sovereignty_surface_binding_pass == true and\n+  .audit_epoch_order_proof_pass == true and\n+  .unbound_physical_activation_reconciliation_pass == true and\n+  .capsule_integrity_pass == true and\n   .bft_overhead_pct_p99 <= 1.0 and\n   .bisimulation_depth12_pass_rate >= 0.99 and\n   .revocation_miss_count == 0\n@@ -2074,3 +2081,3 @@ Downstream dependency notes:\n | `TCK-PSI-0014` | `TCK-PSI-0013` | Scale/bisimulation/overhead/adversarial acceptance suite | `acceptance_suite_pass == true` | `evidence/rfcs/RFC-0022/tickets/TCK-PSI-0014/` |\n | `TCK-PSI-0015` | `TCK-PSI-0010`,`TCK-PSI-0012` | `SovereigntyConstraintMutationReceiptV1` + `GATE-PSI-SELF-MOD-LOCK` implementation | `unauthorized_sovereignty_constraint_mutation_count == 0 and mutation_receipt_chain_valid == true` | `evidence/rfcs/RFC-0022/tickets/TCK-PSI-0015/` |\n-| `TCK-PSI-0016` | `TCK-PSI-0001`,`TCK-PSI-0009`,`TCK-PSI-0012` | Classification lattice profile + proof complexity profile evaluators + audit epoch-order proof verifier | `classification_lattice_profile_valid == true and proof_profile_valid == true and audit_epoch_order_proof_pass == true` | `evidence/rfcs/RFC-0022/tickets/TCK-PSI-0016/` |\n+| `TCK-PSI-0016` | `TCK-PSI-0001`,`TCK-PSI-0009`,`TCK-PSI-0012` | Classification lattice profile + proof complexity profile + audit bypass manifest + epoch-order proof verifiers | `classification_lattice_profile_valid == true and proof_profile_valid == true and audit_epoch_order_proof_pass == true and audit_bypass_manifest_valid == true` | `evidence/rfcs/RFC-0022/tickets/TCK-PSI-0016/` |\n | `TCK-PSI-0017` | `TCK-PSI-0004`,`TCK-PSI-0005`,`TCK-PSI-0011`,`TCK-PSI-0012` | `SovereignResumeOrderV1` admission path and no-implicit-unfreeze enforcement | `resume_without_required_proofs_count == 0 and implicit_unfreeze_count == 0` | `evidence/rfcs/RFC-0022/tickets/TCK-PSI-0017/` |"
  ],
  "predicted_delta": {
    "security": 0.12,
    "robustness": 0.08,
    "reliability": 0.05,
    "performance": 0.0,
    "implementability": -0.02,
    "verifiability": 0.15
  },
  "risk_flags": [
    "RISK-PSI-IMPL-01: Dual replay guard for hardware kill activation (actuator_id + activation_edge_tick + challenge_nonce_echo) increases verifier state retention surface; implementers must bound nonce cache by activation validity window to prevent unbounded growth.",
    "RISK-PSI-IMPL-02: Null-bound activation reconciliation requirement may delay resume operations if reconciliation receipt generation is slow; operators should provision reconciliation path capacity for worst-case physical-activation frequency.",
    "RISK-PSI-ACCEPT-01: Addition of audit_epoch_order_proof_pass, unbound_physical_activation_reconciliation_pass, and capsule_integrity_pass to acceptance predicate increases gate surface; these predicates were already specified but not machine-verified in acceptance, so this is a verification-correctness improvement with low regression risk."
  ]
}